[
  {
    "id": "src-spice-data-centres-2026",
    "title": "Data Centres (SPICe Spotlight briefing)",
    "publisher": "Scottish Parliament Information Centre (SPICe)",
    "source_type": "parliamentary_material",
    "url": "https://spice-spotlight.scot/2026/06/26/data-centres/",
    "publication_date": "2026-06-26",
    "retrieved_date": "2026-07-30",
    "reliability_tier": 2,
    "perspective": "Neutral parliamentary research service",
    "status": "active",
    "notes": "Covers Cato (280,000 m2, 35 m, 400-4,000 GWh/yr), Larbert (128,863 m2), Rufus (540 MW), Gogar (200 MW); Scotland generated 51.8 TWh in 2024 (91.5% renewable); cites APRS mapping of 26 proposals."
  },
  {
    "id": "src-aprs-map",
    "title": "Data Centre Map (Scotland proposals tracker)",
    "publisher": "Action to Protect Rural Scotland (APRS)",
    "source_type": "campaign_material",
    "url": "https://aprs.scot/data-centre-map/",
    "retrieved_date": "2026-07-30",
    "reliability_tier": 5,
    "perspective": "Campaign group advocating a moratorium; useful census but figures must be verified against planning records",
    "status": "active",
    "notes": "26 projects with per-site pages linking planning documents. No downloadable dataset."
  },
  {
    "id": "src-ofgem-dc-connection-reforms-2026",
    "title": "Proposed Data Centre Connection Reforms (consultation)",
    "publisher": "Ofgem",
    "source_type": "regulator_publication",
    "url": "https://www.ofgem.gov.uk/consultation/proposed-data-centre-connection-reforms",
    "publication_date": "2026-07-29",
    "retrieved_date": "2026-07-30",
    "reliability_tier": 2,
    "perspective": "Independent energy regulator",
    "status": "active",
    "notes": "Demand connection queue grew 41 GW to 125 GW (Nov 2024 - Jun 2025), ~80 GW attributed to data centres. Proposes commitment fee of GBP 237,500-712,500/MW. Closes 16 Sep 2026. Aggregate figures only; no project-level demand register."
  },
  {
    "id": "src-scotgov-green-datacentres-plan",
    "title": "Green Datacentres and Digital Connectivity: Vision and Action Plan for Scotland",
    "publisher": "Scottish Government",
    "source_type": "government_publication",
    "url": "https://www.gov.scot/publications/green-datacentres-and-digital-connectivity-vision-and-action-plan-for-scotland/",
    "publication_date": "2021-03-31",
    "retrieved_date": "2026-07-30",
    "reliability_tier": 2,
    "perspective": "Government strategy promoting Scotland as a data-hosting location",
    "status": "active"
  },
  {
    "id": "src-ukgov-aigz-statement-2026",
    "title": "AI Growth Zones written statement HLWS1290 (Lanarkshire designation)",
    "publisher": "UK Parliament / UK Government",
    "source_type": "parliamentary_material",
    "url": "https://questions-statements.parliament.uk/written-statements/detail/2026-01-29/hlws1290",
    "publication_date": "2026-01-29",
    "retrieved_date": "2026-07-30",
    "reliability_tier": 2,
    "status": "active",
    "notes": "Designates Lanarkshire AI Growth Zone centred on DataVita Chapelhall/Airdrie sites with CoreWeave anchor; 500 MW AI-ready capacity, >1 GW private-wire renewables, GBP 8.2bn claim."
  },
  {
    "id": "src-neso-tec-register",
    "title": "Transmission Entry Capacity (TEC) Register",
    "publisher": "NESO",
    "source_type": "grid_data",
    "url": "https://www.neso.energy/data-portal/transmission-entry-capacity-tec-register",
    "retrieved_date": "2026-07-30",
    "reliability_tier": 1,
    "status": "active",
    "notes": "CSV/API, updated twice weekly. Generation-focused; NESO confirmed via FOI that no public register of demand connections exists — the data-centre demand queue is not project-level public data."
  },
  {
    "id": "src-falkirk-portal-p260237",
    "title": "Planning application P/26/0237/FUL — Construction of an AI Data Centre with 300MW Demand Utility Capacity, Land to the northeast of Glenbervie Nursery, Stirling Road, Larbert",
    "publisher": "Falkirk Council (eDevelopment / Idox Public Access)",
    "source_type": "planning_portal",
    "url": "https://edevelopment.falkirk.gov.uk/online/simpleSearchResults.do?action=firstPage&searchType=Application&searchCriteria.reference=P/26/0237/FUL",
    "retrieved_date": "2026-07-30",
    "reliability_tier": 1,
    "notes": "Received 2026-05-29, validated 2026-06-04, status 'Awaiting decision'. Portal showed 7,130 comments, 133 documents, 6 constraints at retrieval. Direct applicationDetails URL requires the record keyVal; use reference search."
  },
  {
    "id": "src-aprs-planning-statement-pdf",
    "title": "Planning Statement for P/26/0237/FUL (portal document 1644123, mirrored by APRS)",
    "publisher": "Apatura / Falkirk Council portal (mirrored by Action to Protect Rural Scotland)",
    "source_type": "planning_document",
    "url": "https://aprs.scot/wp-content/uploads/2026/06/P_26_0237_FUL-Planning_Statement-1644123.pdf",
    "retrieved_date": "2026-07-30",
    "reliability_tier": 1,
    "status": "active",
    "notes": "Could not be downloaded during this research session (APRS bot-protection captcha); cited only as corroboration that the application reference is P/26/0237/FUL. No values were taken from it."
  },
  {
    "id": "src-apatura-news-submission",
    "title": "Plans submitted to Falkirk Council for Larbert Data Centre Campus",
    "publisher": "Apatura",
    "source_type": "developer_publication",
    "url": "https://apatura.energy/news-insights/larbert-data-centre-campus-plans-submitted-to-falkirk-council-for-larbert-data-centre-campus/",
    "publication_date": "2026-06-09",
    "retrieved_date": "2026-07-30",
    "reliability_tier": 3,
    "perspective": "Developer promotional material"
  },
  {
    "id": "src-apatura-consult-project",
    "title": "Larbert AI Data Campus — public consultation project page and timeline",
    "publisher": "Apatura (consult.apatura.energy)",
    "source_type": "developer_publication",
    "url": "https://consult.apatura.energy/larbert/project",
    "retrieved_date": "2026-07-30",
    "reliability_tier": 3,
    "perspective": "Developer consultation material",
    "notes": "Timeline: grid offer accepted Q2 2025; consultations Q4 2025; application Q2 2026; remediation Q3 2026; construction 2027-2028; operations 2029. Describes ~50 acres of mainly vacant grassland beside Glenbervie Business Park."
  },
  {
    "id": "src-spice-data-centres",
    "title": "SPICe Spotlight: Data Centres",
    "publisher": "Scottish Parliament Information Centre (SPICe)",
    "source_type": "parliamentary_material",
    "url": "https://spice-spotlight.scot/2026/06/26/data-centres/",
    "publication_date": "2026-06-26",
    "retrieved_date": "2026-07-30",
    "reliability_tier": 2,
    "notes": "States Larbert campus comprises two data centre buildings of 128,863 m2 floor area, 25 m high (flues to 28 m), plus an 11,500 m2 electricity substation and associated facilities."
  },
  {
    "id": "src-stv-fears",
    "title": "'You don't want this where you live': Fears over plans for massive AI data centre in Larbert",
    "publisher": "STV News",
    "source_type": "journalism",
    "url": "https://news.stv.tv/east-central/you-dont-want-this-where-you-live-fears-over-plans-for-massive-ai-data-centre-in-larbert",
    "retrieved_date": "2026-07-30",
    "reliability_tier": 4,
    "notes": "Reports 200 backup diesel generators with 48-hour fuel supply, closed-loop cooling, 'district heat ready' design, 1,100+ objections at time of writing, campaign groups and public meeting of 25 June 2026, 21-day comment period ending 2026-07-02, pre-determination hearing required."
  },
  {
    "id": "src-stv-deadline",
    "title": "Deadline approaches for views on 'humungous' planned data centres in Falkirk and Fife",
    "publisher": "STV News",
    "source_type": "journalism",
    "url": "https://news.stv.tv/east-central/deadline-approaches-for-views-on-humungous-planned-data-centres-in-falkirk-and-fife",
    "retrieved_date": "2026-07-30",
    "reliability_tier": 4,
    "notes": "Consultation deadline 2026-07-02; 3,100+ objections at time of writing; Larbert (300MW) and Auchtertool, Fife (600MW) together 900MW."
  },
  {
    "id": "src-deadline-news-objections",
    "title": "Larbert AI Data Centre: what happens next after more than 6,700 objections?",
    "publisher": "Deadline News",
    "source_type": "journalism",
    "url": "https://www.deadlinenews.co.uk/2026/07/03/larbert-ai-data-centre-what-happens-next-after-more-than-6700-objections/",
    "publication_date": "2026-07-03",
    "retrieved_date": "2026-07-30",
    "reliability_tier": 4,
    "notes": "Reports (via search excerpt; page itself returned 403) applicant Apatura DC Project 5 Ltd; 6,833 comments of which 6,719 objections and 80 support as of consultation close 2026-07-02."
  },
  {
    "id": "src-dcd-relocation",
    "title": "Apatura changes location of planned 300MW data center campus in Scotland",
    "publisher": "Data Centre Dynamics (DCD)",
    "source_type": "journalism",
    "url": "https://www.datacenterdynamics.com/en/news/apatura-changes-location-of-planned-300mw-data-center-campus-in-scotland/",
    "publication_date": "2025-10-21",
    "retrieved_date": "2026-07-30",
    "reliability_tier": 4,
    "notes": "Reports (via search excerpt; page returned 403) the 300MW campus was originally proposed on agricultural land near Plean, Stirling, and was relocated ~3 miles to Glenbervie Business Centre, Larbert, in October 2025."
  },
  {
    "id": "src-futurescot",
    "title": "Falkirk could be site of one of largest datacentres in the UK — with plans for development submitted to council",
    "publisher": "FutureScot",
    "source_type": "journalism",
    "url": "https://futurescot.com/falkirk-could-be-site-of-one-of-largest-datacentres-in-the-uk-with-plans-for-development-submitted-to-council/",
    "publication_date": "2026-06-09",
    "retrieved_date": "2026-07-30",
    "reliability_tier": 4,